{
  "schema_version": "1.0.0",
  "tool": "slither",
  "scope": {
    "case_ids": [
      "case005"
    ],
    "cases": 1,
    "ground_truth_labels": 18,
    "findings": 42
  },
  "counts": {
    "true_positive": 1,
    "false_positive": 41,
    "false_negative": 17,
    "duplicates": 0
  },
  "metrics": {
    "precision": 0.02381,
    "recall": 0.055556,
    "f1": 0.033334,
    "false_positives_per_case": 41.0
  },
  "limitations": [
    "Scores apply only to the selected Litmus cases and labels.",
    "A score is not an audit, safety certificate, or production-readiness proof."
  ]
}
